{
  "$schema": "https://json-schema.org/draft/2020-12/schema",
  "$id": "https://hayati.app/schemas/question-pack.schema.json",
  "title": "Hayati Question Pack",
  "description": "The question-pack contract (docs/architecture.md §3, docs/prd.md §7). Enforced since M3.1 by content/validator/validate.dart, which also cross-checks its own vocabulary against this file on every run — change enums/bounds/required fields here and in validator_core.dart together, or CI fails loudly.",
  "type": "object",
  "required": ["packId", "version", "locale", "register", "questions"],
  "additionalProperties": false,
  "properties": {
    "packId": {
      "type": "string",
      "pattern": "^[a-z0-9_]+$",
      "description": "Stable pack identifier, e.g. tr_playful, tr_respectful, ar_msa_gulf, en"
    },
    "version": {
      "type": "integer",
      "minimum": 1,
      "description": "Monotonically increasing pack version for remote sync"
    },
    "locale": { "type": "string", "enum": ["tr", "ar", "en"] },
    "register": {
      "type": "string",
      "enum": ["playful", "respectful", "msa_gulf", "neutral"],
      "description": "Tone register per docs/frontend-brandkit.md §7"
    },
    "reviewedBy": {
      "type": "string",
      "description": "Native register owner who approved this pack (mandatory before shipping; Gulf reviewer for AR — docs/prd.md §7)"
    },
    "questions": {
      "type": "array",
      "minItems": 1,
      "items": {
        "type": "object",
        "required": ["id", "category", "depth", "text"],
        "additionalProperties": false,
        "properties": {
          "id": { "type": "string", "pattern": "^[a-z0-9_]+$" },
          "category": {
            "type": "string",
            "enum": ["fun", "deep", "memories", "future", "gratitude"]
          },
          "depth": {
            "type": "integer",
            "minimum": 1,
            "maximum": 5,
            "description": "1 = icebreaker, 5 = deepest; drives paywall depth gating"
          },
          "seasonalWindow": {
            "type": "string",
            "enum": ["ramadan", "eid_fitr", "eid_adha", "new_year"],
            "description": "Optional seasonal window (ADR-026); absent = evergreen. ramadan = the whole Hijri month 9; eid_fitr = Shawwal 1-3; eid_adha = Dhu al-Hijjah 10-13; new_year = Dec 31 - Jan 1. A closed vocabulary on purpose: a free-string tag that nothing recognises is a question that is never selected, silently, forever."
          },
          "text": { "type": "string", "minLength": 1 }
        }
      }
    }
  }
}
